Q1.2,Age,Gender,Gender_3_TEXT,Race,Race_6_TEXT,Educ,Status,Identity Nominations_1,Identity Nominations_35,Identity Nominations_36,Identity Nominations_37,Identity Nominations_38,Identity Nominations_39,Identity Nominations_40,Identity Nominations_41,Identity Nominations_42,Identity Nominations_43,Identity Nominations_44,Identity Nominations_45,Identity Nominations_46,Identity Nominations_47,Identity Nominations_48,I1_Cat,I1_Cat_12_TEXT,I1_Race_Type,I1_Race_Type_9_TEXT,I1_Gen_Type,I1_Gen_Type_6_TEXT,I1_Sex_Type,I1_Sex_Type_7_TEXT,I1_Rel_Type,I1_Rel_Type_10_TEXT,I1_SES_Type,I1_SES_Type_7_TEXT,I1_Occup_Type,I1_Occup_Type_20_TEXT,I1_Pol_Type,I1_Pol_Type_7_TEXT,I1_Fam_Type,I1_Fam_Type_13_TEXT,I1_Friend_Type,I1_Friend_Type_4_TEXT,I1_Hob_Type,I1_Hob_Type_19_TEXT,I1_Relations,I1_Sims_1,I1_Sims_2,I1_Sims_3,I1_Sims_4,I1_Sims_5,I1_Sims_6,I1_Sims_7,I1_Sims_8,I1_Sims_9,I1_Sims_10,I1_Sims_11,I1_Sims_12,I1_Sims_13,I1_Sims_14,I1_Sims_15,I1_I,I1_P,I1_M,I1_Ent,I1_Sim,I1_Proto,I1_St,I1_Sz_1,I1_Sz_13,I1_A,I1_D,I1_Therm_1,I1_Therm_2,I1_MemUncert,I1_IdUncert,I1_Should,I1_Consist,I1_Salient,I1_Ideal,I1_BExp,I1_GExp,I1_BelPer,I2_Cat,I2_Cat_12_TEXT,I2_Race_Type,I2_Race_Type_9_TEXT,I2_Gen_Type,I2_Gen_Type_6_TEXT,I2_Sex_Type,I2_Sex_Type_7_TEXT,I2_Rel_Type,I2_Rel_Type_10_TEXT,I2_SES_Type,I2_SES_Type_7_TEXT,I2_Occup_Type,I2_Occup_Type_20_TEXT,I2_Pol_Type,I2_Pol_Type_7_TEXT,I2_Fam_Type,I2_Fam_Type_13_TEXT,I2_Friend_Type,I2_Friend_Type_4_TEXT,I2_Hob_Type,I2_Hob_Type_19_TEXT,I2_Relations,I2_Sims_1,I2_Sims_2,I2_Sims_3,I2_Sims_4,I2_Sims_5,I2_Sims_6,I2_Sims_7,I2_Sims_8,I2_Sims_9,I2_Sims_10,I2_Sims_11,I2_Sims_12,I2_Sims_13,I2_Sims_14,I2_Sims_15,I2_I,I2_P,I2_M,I2_Ent,I2_Sim,I2_Proto,I2_St,I2_Sz_1,I2_Sz_13,I2_A,I2_D,I2_Therm_1,I2_Therm_2,I2_MemUncert,I2_IdUncert,I2_Should,I2_Consist,I2_Salient,I2_Ideal,I2_BExp,I2_GExp,I2_BelPer,I3_Cat,I3_Cat_12_TEXT,I3_Race_Type,I3_Race_Type_9_TEXT,I3_Gen_Type,I3_Gen_Type_6_TEXT,I3_Sex_Type,I3_Sex_Type_7_TEXT,I3_Rel_Type,I3_Rel_Type_10_TEXT,I3_SES_Type,I3_SES_Type_7_TEXT,I3_Occup_Type,I3_Occup_Type_20_TEXT,I3_Pol_Type,I3_Pol_Type_7_TEXT,I3_Fam_Type,I3_Fam_Type_13_TEXT,I3_Friend_Type,I3_Friend_Type_4_TEXT,I3_Hob_Type,I3_Hob_Type_19_TEXT,I3_Relations,I3_Sims_1,I3_Sims_2,I3_Sims_3,I3_Sims_4,I3_Sims_5,I3_Sims_6,I3_Sims_7,I3_Sims_8,I3_Sims_9,I3_Sims_10,I3_Sims_11,I3_Sims_12,I3_Sims_13,I3_Sims_14,I3_Sims_15,I3_I,I3_P,I3_M,I3_Ent,I3_Sim,I3_Proto,I3_St,I3_Sz_1,I3_Sz_13,I3_A,I3_D,I3_Therm_1,I3_Therm_2,I3_MemUncert,I3_IdUncert,I3_Should,I3_Consist,I3_Salient,I3_Ideal,I3_BExp,I3_GExp,I3_BelPer,I4_Cat,I4_Cat_12_TEXT,I4_Race_Type,I4_Race_Type_9_TEXT,I4_Gen_Type,I4_Gen_Type_6_TEXT,I4_Sex_Type,I4_Sex_Type_7_TEXT,I4_Rel_Type,I4_Rel_Type_10_TEXT,I4_SES_Type,I4_SES_Type_7_TEXT,I4_Occup_Type,I4_Occup_Type_20_TEXT,I4_Pol_Type,I4_Pol_Type_7_TEXT,I4_Fam_Type,I4_Fam_Type_13_TEXT,I4_Friend_Type,I4_Friend_Type_4_TEXT,I4_Hob_Type,I4_Hob_Type_19_TEXT,I4_Relations,I4_Sims_1,I4_Sims_2,I4_Sims_3,I4_Sims_4,I4_Sims_5,I4_Sims_6,I4_Sims_7,I4_Sims_8,I4_Sims_9,I4_Sims_10,I4_Sims_11,I4_Sims_12,I4_Sims_13,I4_Sims_14,I4_Sims_15,I4_I,I4_P,I4_M,I4_Ent,I4_Sim,I4_Proto,I4_St,I4_Sz_1,I4_Sz_13,I4_A,I4_D,I4_Therm_1,I4_Therm_2,I4_MemUncert,I4_IdUncert,I4_Should,I4_Consist,I4_Salient,I4_Ideal,I4_BExp,I4_GExp,I4_BelPer,I5_Cat,I5_Cat_12_TEXT,I5_Race_Type,I5_Race_Type_9_TEXT,I5_Gen_Type,I5_Gen_Type_6_TEXT,I5_Sex_Type,I5_Sex_Type_7_TEXT,I5_Rel_Type,I5_Rel_Type_10_TEXT,I5_SES_Type,I5_SES_Type_7_TEXT,I5_Occup_Type,I5_Occup_Type_20_TEXT,I5_Pol_Type,I5_Pol_Type_7_TEXT,I5_Fam_Type,I5_Fam_Type_13_TEXT,I5_Friend_Type,I5_Friend_Type_4_TEXT,I5_Hob_Type,I5_Hob_Type_19_TEXT,I5_Relations,I5_Sims_1,I5_Sims_2,I5_Sims_3,I5_Sims_4,I5_Sims_5,I5_Sims_6,I5_Sims_7,I5_Sims_8,I5_Sims_9,I5_Sims_10,I5_Sims_11,I5_Sims_12,I5_Sims_13,I5_Sims_14,I5_Sims_15,I5_I,I5_P,I5_M,I5_Ent,I5_Sim,I5_Proto,I5_St,I5_Sz_1,I5_Sz_13,I5_A,I5_D,I5_Therm_1,I5_Therm_2,I5_MemUncert,I5_IdUncert,I5_Should,I5_Consist,I5_Salient,I5_Ideal,I5_BExp,I5_GExp,I5_BelPer,I6_Cat,I6_Cat_12_TEXT,I6_Race_Type,I6_Race_Type_9_TEXT,I6_Gen_Type,I6_Gen_Type_6_TEXT,I6_Sex_Type,I6_Sex_Type_7_TEXT,I6_Rel_Type,I6_Rel_Type_10_TEXT,I6_SES_Type,I6_SES_Type_7_TEXT,I6_Occup_Type,I6_Occup_Type_20_TEXT,I#_Pol_Type,I#_Pol_Type_7_TEXT,I6_Fam_Type,I6_Fam_Type_13_TEXT,I6_Friend_Type,I6_Friend_Type_4_TEXT,I6_Hob_Type,I6_Hob_Type_19_TEXT,I6_Relations,I6_Sims_1,I6_Sims_2,I6_Sims_3,I6_Sims_4,I6_Sims_5,I6_Sims_6,I6_Sims_7,I6_Sims_8,I6_Sims_9,I6_Sims_10,I6_Sims_11,I6_Sims_12,I6_Sims_13,I6_Sims_14,I6_Sims_15,I6_I,I6_P,I6_M,I6_Ent,I6_Sim,I6_Proto,I6_St,I6_Sz_1,I6_Sz_13,I6_A,I6_D,I6_Therm_1,I6_Therm_2,I6_MemUncert,I6_IdUncert,I6_Should,I6_Consist,I6_Salient,I6_Ideal,I6_BExp,I6_GExp,I6_BelPer,I7_Cat,I7_Cat_12_TEXT,I7_Race_Type,I7_Race_Type_9_TEXT,I7_Gen_Type,I7_Gen_Type_6_TEXT,I7_Sex_Type,I7_Sex_Type_7_TEXT,I7_Rel_Type,I7_Rel_Type_10_TEXT,I7_SES_Type,I7_SES_Type_7_TEXT,I7_Occup_Type,I7_Occup_Type_20_TEXT,I7_Pol_Type,I7_Pol_Type_7_TEXT,I7_Fam_Type,I7_Fam_Type_13_TEXT,I7_Friend_Type,I7_Friend_Type_4_TEXT,I7_Hob_Type,I7_Hob_Type_19_TEXT,I7_Relations,I7_Sims_1,I7_Sims_2,I7_Sims_3,I7_Sims_4,I7_Sims_5,I7_Sims_6,I7_Sims_7,I7_Sims_8,I7_Sims_9,I7_Sims_10,I7_Sims_11,I7_Sims_12,I7_Sims_13,I7_Sims_14,I7_Sims_15,I7_I,I7_P,I7_M,I7_Ent,I7_Sim,I7_Proto,I7_St,I7_Sz_1,I7_Sz_13,I7_A,I7_D,I7_Therm_1,I7_Therm_2,I7_MemUncert,I7_IdUncert,I7_Should,I7_Consist,I7_Salient,I7_Ideal,I7_BExp,I7_GExp,I7_BelPer,I8_Cat,I8_Cat_12_TEXT,I8_Race_Type,I8_Race_Type_9_TEXT,I8_Gen_Type,I8_Gen_Type_6_TEXT,I8_Sex_Type,I8_Sex_Type_7_TEXT,I8_Rel_Type,I8_Rel_Type_10_TEXT,I8_SES_Type,I8_SES_Type_7_TEXT,I8_Occup_Type,I8_Occup_Type_20_TEXT,I8_Pol_Type,I8_Pol_Type_7_TEXT,I8_Fam_Type,I8_Fam_Type_13_TEXT,I8_Friend_Type,I8_Friend_Type_4_TEXT,I8_Hob_Type,I8_Hob_Type_19_TEXT,I8_Relations,I9_Sims_1,I9_Sims_2,I9_Sims_3,I9_Sims_4,I9_Sims_5,I9_Sims_6,I9_Sims_7,I9_Sims_8,I9_Sims_9,I9_Sims_10,I9_Sims_11,I9_Sims_12,I9_Sims_13,I9_Sims_14,I9_Sims_15,I8_I,I8_P,I8_M,I8_Ent,I8_Sim,I8_Proto,I8_St,I8_Sz_1,I8_Sz_13,I8_A,I8_D,I8_Therm_1,I8_Therm_2,I8_MemUncert,I8_IdUncert,I8_Should,I8_Consist,I8_Salient,I8_Ideal,I8_BExp,I8_GExp,I8_BelPer,I9_Cat,I9_Cat_12_TEXT,I9_Race_Type,I9_Race_Type_9_TEXT,I9_Gen_Type,I9_Gen_Type_6_TEXT,I9_Sex_Type,I9_Sex_Type_7_TEXT,I9_Rel_Type,I9_Rel_Type_10_TEXT,I9_SES_Type,I9_SES_Type_7_TEXT,I9_Occup_Type,I9_Occup_Type_20_TEXT,I9_Pol_Type,I9_Pol_Type_7_TEXT,I9_Fam_Type,I9_Fam_Type_13_TEXT,I9_Friend_Type,I9_Friend_Type_4_TEXT,I9_Hob_Type,I9_Hob_Type_19_TEXT,I9_Relations,I9_Sims_1,I9_Sims_2,I9_Sims_3,I9_Sims_4,I9_Sims_5,I9_Sims_6,I9_Sims_7,I9_Sims_8,I9_Sims_9,I9_Sims_10,I9_Sims_11,I9_Sims_12,I9_Sims_13,I9_Sims_14,I9_Sims_15,I9_I,I9_P,I9_M,I9_Ent,I9_Sim,I9_Proto,I9_St,I9_Sz_1,I9_Sz_13,I9_A,I9_D,I9_Therm_1,I9_Therm_2,I9_MemUncert,I9_IdUncert,I9_Should,I9_Consist,I9_Salient,I9_Ideal,I9_BExp,I9_GExp,I9_BelPer,I10_Cat,I10_Cat_12_TEXT,I10_Race_Type,I10_Race_Type_9_TEXT,I10_Gen_Type,I10_Gen_Type_6_TEXT,I10_Sex_Type,I10_Sex_Type_7_TEXT,I10_Rel_Type,I10_Rel_Type_10_TEXT,I10_SES_Type,I10_SES_Type_7_TEXT,I10_Occup_Type,I10_Occup_Type_20_TEXT,I10_Pol_Type,I10_Pol_Type_7_TEXT,I10_Fam_Type,I10_Fam_Type_13_TEXT,I10_Friend_Type,I10_Friend_Type_4_TEXT,I10_Hob_Type,I10_Hob_Type_19_TEXT,I10_Relations,I10_Sims_1,I10_Sims_2,I10_Sims_3,I10_Sims_4,I10_Sims_5,I10_Sims_6,I10_Sims_7,I10_Sims_8,I10_Sims_9,I10_Sims_10,I10_Sims_11,I10_Sims_12,I10_Sims_13,I10_Sims_14,I10_Sims_15,I10_I,I10_P,I10_M,I10_Ent,I10_Sim,I10_Proto,I10_St,I10_Sz_1,I10_Sz_13,I10_A,I10_D,I10_Therm_1,I10_Therm_2,I10_MemUncert,I10_IdUncert,I10_Should,I10_Consist,I10_Salient,I10_Ideal,I10_BExp,I10_GExp,I10_BelPer,I11_Cat,I11_Cat_12_TEXT,I11_Race_Type,I11_Race_Type_9_TEXT,I11_Gen_Type,I11_Gen_Type_6_TEXT,I11_Sex_Type,I11_Sex_Type_7_TEXT,I11_Rel_Type,I11_Rel_Type_10_TEXT,I11_SES_Type,I11_SES_Type_7_TEXT,I11_Occup_Type,I11_Occup_Type_20_TEXT,I11_Pol_Type,I11_Pol_Type_7_TEXT,I11_Fam_Type,I11_Fam_Type_13_TEXT,I11_Friend_Type,I11_Friend_Type_4_TEXT,I11_Hob_Type,I11_Hob_Type_19_TEXT,I11_Relations,I11_Sims_1,I11_Sims_2,I11_Sims_3,I11_Sims_4,I11_Sims_5,I11_Sims_6,I11_Sims_7,I11_Sims_8,I11_Sims_9,I11_Sims_10,I11_Sims_11,I11_Sims_12,I11_Sims_13,I11_Sims_14,I11_Sims_15,I11_I,I11_P,I11_M,I11_Ent,I11_Sim,I11_Proto,I11_St,I11_Sz_1,I11_Sz_13,I11_A,I11_D,I11_Therm_1,I11_Therm_2,I11_MemUncert,I11_IdUncert,I11_Should,I11_Consist,I11_Salient,I11_Ideal,I11_BExp,I11_GExp,I11_BelPer,I12_Cat,I12_Cat_12_TEXT,I12_Race_Type,I12_Race_Type_9_TEXT,I12_Gen_Type,I12_Gen_Type_6_TEXT,I12_Sex_Type,I12_Sex_Type_7_TEXT,I12_Rel_Type,I12_Rel_Type_10_TEXT,I12_SES_Type,I12_SES_Type_7_TEXT,I12_Occup_Type,I12_Occup_Type_20_TEXT,I12_Pol_Type,I12_Pol_Type_7_TEXT,I12_Fam_Type,I12_Fam_Type_13_TEXT,I12_Friend_Type,I12_Friend_Type_4_TEXT,I12_Hob_Type,I12_Hob_Type_19_TEXT,I12_Relations,I12_Sims_1,I12_Sims_2,I12_Sims_3,I12_Sims_4,I12_Sims_5,I12_Sims_6,I12_Sims_7,I12_Sims_8,I12_Sims_9,I12_Sims_10,I12_Sims_11,I12_Sims_12,I12_Sims_13,I12_Sims_14,I12_Sims_15,I12_I,I12_P,I12_M,I12_Ent,I12_Sim,I12_Proto,I12_St,I12_Sz_1,I12_Sz_13,I12_A,I12_D,I12_Therm_1,I12_Therm_2,I12_MemUncert,I12_IdUncert,I12_Should,I12_Consist,I12_Salient,I12_Ideal,I12_BExp,I12_GExp,I12_BelPer,I13_Cat,I13_Cat_12_TEXT,I13_Race_Type,I13_Race_Type_9_TEXT,I13_Gen_Type,I13_Gen_Type_6_TEXT,I13_Sex_Type,I13_Sex_Type_7_TEXT,I13_Rel_Type,I13_Rel_Type_10_TEXT,I13_SES_Type,I13_SES_Type_7_TEXT,I13_Occup_Type,I13_Occup_Type_20_TEXT,I13_Pol_Type,I13_Pol_Type_7_TEXT,I13_Fam_Type,I13_Fam_Type_13_TEXT,I13_Friend_Type,I13_Friend_Type_4_TEXT,I13_Hob_Type,I13_Hob_Type_19_TEXT,I13_Relations,I13_Sims_1,I13_Sims_2,I13_Sims_3,I13_Sims_4,I13_Sims_5,I13_Sims_6,I13_Sims_7,I13_Sims_8,I13_Sims_9,I13_Sims_10,I13_Sims_11,I13_Sims_12,I13_Sims_13,I13_Sims_14,I13_Sims_15,I13_I,I13_P,I13_M,I13_Ent,I13_Sim,I13_Proto,I13_St,I13_Sz_1,I13_Sz_13,I13_A,I13_D,I13_Therm_1,I13_Therm_2,I13_MemUncert,I13_IdUncert,I13_Should,I13_Consist,I13_Salient,I13_Ideal,I13_BExp,I13_GExp,I13_BelPer,I14_Cat,I14_Cat_12_TEXT,I14_Race_Type,I14_Race_Type_9_TEXT,I14_Gen_Type,I14_Gen_Type_6_TEXT,I14_Sex_Type,I14_Sex_Type_7_TEXT,I14_Rel_Type,I14_Rel_Type_10_TEXT,I14_SES_Type,I14_SES_Type_7_TEXT,I14_Occup_Type,I14_Occup_Type_20_TEXT,I14_Pol_Type,I14_Pol_Type_7_TEXT,I14_Fam_Type,I14_Fam_Type_13_TEXT,I14_Friend_Type,I14_Friend_Type_4_TEXT,I14_Hob_Type,I14_Hob_Type_19_TEXT,I14_Relations,I14_Sims_1,I14_Sims_2,I14_Sims_3,I14_Sims_4,I14_Sims_5,I14_Sims_6,I14_Sims_7,I14_Sims_8,I14_Sims_9,I14_Sims_10,I14_Sims_11,I14_Sims_12,I14_Sims_13,I14_Sims_14,I14_Sims_15,I14_I,I14_P,I14_M,I14_Ent,I14_Sim,I14_Proto,I14_St,I14_Sz_1,I14_Sz_13,I14_A,I14_D,I14_Therm_1,I14_Therm_2,I14_MemUncert,I14_IdUncert,I14_Should,I14_Consist,I14_Salient,I14_Ideal,I14_BExp,I14_GExp,I14_BelPer,I15_Cat,I15_Cat_12_TEXT,I15_Race_Type,I15_Race_Type_9_TEXT,I15_Gen_Type,I15_Gen_Type_6_TEXT,I15_Sex_Type,I15_Sex_Type_7_TEXT,I15_Rel_Type,I15_Rel_Type_10_TEXT,I15_SES_Type,I15_SES_Type_7_TEXT,I15_Occup_Type,I15_Occup_Type_20_TEXT,I15_Pol_Type,I15_Pol_Type_7_TEXT,I15_Fam_Type,I15_Fam_Type_13_TEXT,I15_Friend_Type,I15_Friend_Type_4_TEXT,I15_Hob_Type,I15_Hob_Type_19_TEXT,I15_Relations,I15_Sims_1,I15_Sims_2,I15_Sims_3,I15_Sims_4,I15_Sims_5,I15_Sims_6,I15_Sims_7,I15_Sims_8,I15_Sims_9,I15_Sims_10,I15_Sims_11,I15_Sims_12,I15_Sims_13,I15_Sims_14,I15_Sims_15,I15_I,I15_P,I15_M,I15_Ent,I15_Sim,I15_Proto,I15_St,I15_Sz_1,I15_Sz_13,I15_A,I15_D,I15_Therm_1,I15_Therm_2,I15_MemUncert,I15_IdUncert,I15_Should,I15_Consist,I15_Salient,I15_Ideal,I15_BExp,I15_GExp,I15_BelPer,RSE1,RSE2,RSE3,RSE4,RSE5,RSE6,RSE7,RSE8,RSE9,RSE10,NFC-6_1,NFC-6_2,NFC-6_3,NFC-6_4,NFC-6_5,NFC-6_6,SCC1,SCC2,SCC3,SCC4,SCC5,SCC6,SCC7,SCC8,SCC9,SCC10,SCC11,SCC12,UnlistId,Confusing,UnderstandRelate,UnderstandSimilar,UnderstandCategory,Serious,Usable,Comments,id,ID1,C1,IDC1,ID2,C2,IDC2,ID3,C3,IDC3,ID4,C4,IDC4,ID5,C5,IDC5,ID6,C6,IDC6,ID7,C7,IDC7,ID8,C8,IDC8,ID9,C9,IDC9,ID10,C10,IDC10,ID11,C11,IDC11,ID12,C12,IDC12,ID13,C13,IDC13,ID14,C14,IDC14,ID15,C15,IDC15
"Informed Consent Agreement

 

By selecting the “CONSENT TO PARTICIPANTE” option below, you are agreeing to participate in this academic study and acknowledge that: 

·      I have read the consent form above 

·      I am between 18 to 65 years old 

·      I am a native English speaker",What is your age?,What is your gender? - Selected Choice,What is your gender? - Other - Text,What is your race/ethnicity? (You can choose more than one answer) - Selected Choice,What is your race/ethnicity? (You can choose more than one answer) - Other - Text,What is the highest degree or level of school you have completed?,"​Think of this ladder as representing where people stand in the United States. At the top of the ladder are the people who are the best off - those who have the most money, the most education, and the most respected jobs. At the bottom are the people who are the worst off - who have the least money, least education, and the least respected jobs or no job.  The higher up you are on this ladder, the closer you are to the people at the very top; the lower you are, the closer you are to the people at the very bottom. 







Please indicate the rung where you think you stand at this time in your life, RELATIVE TO OTHER PEOPLE IN THE UNITED STATES. (1-10)","Please list as many of the social identities you affiliate with or groups you belong to. Meaning, you can list up to 15, but can nominate fewer than 15 as well. - Identity #1","Please list as many of the social identities you affiliate with or groups you belong to. Meaning, you can list up to 15, but can nominate fewer than 15 as well. - Identity #2","Please list as many of the social identities you affiliate with or groups you belong to. Meaning, you can list up to 15, but can nominate fewer than 15 as well. - Identity #3","Please list as many of the social identities you affiliate with or groups you belong to. Meaning, you can list up to 15, but can nominate fewer than 15 as well. - Identity #4","Please list as many of the social identities you affiliate with or groups you belong to. Meaning, you can list up to 15, but can nominate fewer than 15 as well. - Identity #5","Please list as many of the social identities you affiliate with or groups you belong to. Meaning, you can list up to 15, but can nominate fewer than 15 as well. - Identity #6","Please list as many of the social identities you affiliate with or groups you belong to. Meaning, you can list up to 15, but can nominate fewer than 15 as well. - Identity #7","Please list as many of the social identities you affiliate with or groups you belong to. Meaning, you can list up to 15, but can nominate fewer than 15 as well. - Identity #8","Please list as many of the social identities you affiliate with or groups you belong to. Meaning, you can list up to 15, but can nominate fewer than 15 as well. - Identity #9","Please list as many of the social identities you affiliate with or groups you belong to. Meaning, you can list up to 15, but can nominate fewer than 15 as well. - Identity #10","Please list as many of the social identities you affiliate with or groups you belong to. Meaning, you can list up to 15, but can nominate fewer than 15 as well. - Identity #11","Please list as many of the social identities you affiliate with or groups you belong to. Meaning, you can list up to 15, but can nominate fewer than 15 as well. - Identity #12","Please list as many of the social identities you affiliate with or groups you belong to. Meaning, you can list up to 15, but can nominate fewer than 15 as well. - Identity #13","Please list as many of the social identities you affiliate with or groups you belong to. Meaning, you can list up to 15, but can nominate fewer than 15 as well. - Identity #14","Please list as many of the social identities you affiliate with or groups you belong to. Meaning, you can list up to 15, but can nominate fewer than 15 as well. - Identity #15",What category of identity or group membership is [QID261-ChoiceTextEntryValue-1]? - Selected Choice,What category of identity or group membership is [QID261-ChoiceTextEntryValue-1]? - Other - Text,"Indicate which ""racial/ethnic"" identity [QID261-ChoiceTextEntryValue-1] is: - Selected Choice","Indicate which ""racial/ethnic"" identity [QID261-ChoiceTextEntryValue-1] is: - Other/Not Listed - Text","Indicate which ""gender"" identity [QID261-ChoiceTextEntryValue-1] is: - Selected Choice","Indicate which ""gender"" identity [QID261-ChoiceTextEntryValue-1] is: - Other/Not Listed - Text","Indicate which ""sexual orientation"" identity [QID261-ChoiceTextEntryValue-1] is: - Selected Choice","Indicate which ""sexual orientation"" identity [QID261-ChoiceTextEntryValue-1] is: - Other/Not Listed - Text","Indicate which ""religious"" identity [QID261-ChoiceTextEntryValue-1] is: - Selected Choice","Indicate which ""religious"" identity [QID261-ChoiceTextEntryValue-1] is: - Other/Not Listed - Text","Indicate which ""socioeconomic"" identity [QID261-ChoiceTextEntryValue-1] is: - Selected Choice","Indicate which ""socioeconomic"" identity [QID261-ChoiceTextEntryValue-1] is: - Not Listed/Other - Text","Indicate which ""occupational"" identity [QID261-ChoiceTextEntryValue-1] is: - Selected Choice","Indicate which ""occupational"" identity [QID261-ChoiceTextEntryValue-1] is: - Other/Not Listed - Text","Indicate which ""political"" identity [QID261-ChoiceTextEntryValue-1] is - Selected Choice","Indicate which ""political"" identity [QID261-ChoiceTextEntryValue-1] is - Other/Not Listed - Text","Indicate which ""family"" identity [QID261-ChoiceTextEntryValue-1] is: - Selected Choice","Indicate which ""family"" identity [QID261-ChoiceTextEntryValue-1] is: - Other - Text","Indicate which ""friend"" identity [QID261-ChoiceTextEntryValue-1] is - Selected Choice","Indicate which ""friend"" identity [QID261-ChoiceTextEntryValue-1] is - Other - Text","Indicate which ""hobby/ability"" identity [QID261-ChoiceTextEntryValue-1] is: - Selected Choice","Indicate which ""hobby/ability"" identity [QID261-ChoiceTextEntryValue-1] is: - Other/Not Listed - Text","When considering whether an identity relates to another identity, consider how much subjective overlap you perceive there to be between these social groups/identities. 

Which identities are related to [QID261-ChoiceTextEntryValue-1]? Please select all that apply.
Note: The identity for the current evaluation will appear as an option below. Please ignore, as self-selecting the identity as relating to itself is redundant.","How close/similar is [QID261-ChoiceTextEntryValue-1] to each of the below identities?



When considering how similar they are, consider the two groups/identities in terms of their similarity of prototypical values, norms, and other characteristics, or their overlap in terms of shared membership. - Identity #1","How close/similar is [QID261-ChoiceTextEntryValue-1] to each of the below identities?



When considering how similar they are, consider the two groups/identities in terms of their similarity of prototypical values, norms, and other characteristics, or their overlap in terms of shared membership. - Identity #2","How close/similar is [QID261-ChoiceTextEntryValue-1] to each of the below identities?



When considering how similar they are, consider the two groups/identities in terms of their similarity of prototypical values, norms, and other characteristics, or their overlap in terms of shared membership. - Identity #3","How close/similar is [QID261-ChoiceTextEntryValue-1] to each of the below identities?



When considering how similar they are, consider the two groups/identities in terms of their similarity of prototypical values, norms, and other characteristics, or their overlap in terms of shared membership. - Identity #4","How close/similar is [QID261-ChoiceTextEntryValue-1] to each of the below identities?



When considering how similar they are, consider the two groups/identities in terms of their similarity of prototypical values, norms, and other characteristics, or their overlap in terms of shared membership. - Identity #5","How close/similar is [QID261-ChoiceTextEntryValue-1] to each of the below identities?



When considering how similar they are, consider the two groups/identities in terms of their similarity of prototypical values, norms, and other characteristics, or their overlap in terms of shared membership. - Identity #6","How close/similar is [QID261-ChoiceTextEntryValue-1] to each of the below identities?



When considering how similar they are, consider the two groups/identities in terms of their similarity of prototypical values, norms, and other characteristics, or their overlap in terms of shared membership. - Identity #7","How close/similar is [QID261-ChoiceTextEntryValue-1] to each of the below identities?



When considering how similar they are, consider the two groups/identities in terms of their similarity of prototypical values, norms, and other characteristics, or their overlap in terms of shared membership. - Identity #8","How close/similar is [QID261-ChoiceTextEntryValue-1] to each of the below identities?



When considering how similar they are, consider the two groups/identities in terms of their similarity of prototypical values, norms, and other characteristics, or their overlap in terms of shared membership. - Identity #9","How close/similar is [QID261-ChoiceTextEntryValue-1] to each of the below identities?



When considering how similar they are, consider the two groups/identities in terms of their similarity of prototypical values, norms, and other characteristics, or their overlap in terms of shared membership. - Identity #10","How close/similar is [QID261-ChoiceTextEntryValue-1] to each of the below identities?



When considering how similar they are, consider the two groups/identities in terms of their similarity of prototypical values, norms, and other characteristics, or their overlap in terms of shared membership. - Identity #11","How close/similar is [QID261-ChoiceTextEntryValue-1] to each of the below identities?



When considering how similar they are, consider the two groups/identities in terms of their similarity of prototypical values, norms, and other characteristics, or their overlap in terms of shared membership. - Identity #12","How close/similar is [QID261-ChoiceTextEntryValue-1] to each of the below identities?



When considering how similar they are, consider the two groups/identities in terms of their similarity of prototypical values, norms, and other characteristics, or their overlap in terms of shared membership. - Identity #13","How close/similar is [QID261-ChoiceTextEntryValue-1] to each of the below identities?



When considering how similar they are, consider the two groups/identities in terms of their similarity of prototypical values, norms, and other characteristics, or their overlap in terms of shared membership. - Identity #14","How close/similar is [QID261-ChoiceTextEntryValue-1] to each of the below identities?



When considering how similar they are, consider the two groups/identities in terms of their similarity of prototypical values, norms, and other characteristics, or their overlap in terms of shared membership. - Identity #15",I identify as [QID261-ChoiceTextEntryValue-1] .,How positive do you feel about being a member of this group: [QID261-ChoiceTextEntryValue-1] ?,It is easy to leave membership of this group: [QID261-ChoiceTextEntryValue-1] .,"[QID261-ChoiceTextEntryValue-1] is a cohesive, united, and tight-knit group.",[QID261-ChoiceTextEntryValue-1] people are similar to each other.,I am representative and fit the description of what it means to be [QID261-ChoiceTextEntryValue-1] .,How stigmatized is [QID261-ChoiceTextEntryValue-1] ?,"To what extent do you feel your [QID261-ChoiceTextEntryValue-1] identity is small and not well-represented (i.e., minority) or large and well-represented (i.e., majority) at your university and in the United States? - University","To what extent do you feel your [QID261-ChoiceTextEntryValue-1] identity is small and not well-represented (i.e., minority) or large and well-represented (i.e., majority) at your university and in the United States? - United States",I am included in the [QID261-ChoiceTextEntryValue-1] group and fit in/belong.,This group is distinct and different from other groups: [QID261-ChoiceTextEntryValue-1] .,Next we would like to get your feelings towards your [QID261-ChoiceTextEntryValue-1] identity and other [QID262-ChoiceGroup-SelectedChoices] groups using something we call the feeling thermometer that ranges from 0 to 100. Ratings between 50° and 100° mean that you feel favorable and warm toward that [QID262-ChoiceGroup-SelectedChoices] group. Ratings between 0° and 50° mean that you do not feel favorable toward that [QID262-ChoiceGroup-SelectedChoices] group. You would rate the [QID262-ChoiceGroup-SelectedChoices] group at the 50° mark if you do not feel particularly warm or cold. - [QID261-ChoiceTextEntryValue-1],Next we would like to get your feelings towards your [QID261-ChoiceTextEntryValue-1] identity and other [QID262-ChoiceGroup-SelectedChoices] groups using something we call the feeling thermometer that ranges from 0 to 100. Ratings between 50° and 100° mean that you feel favorable and warm toward that [QID262-ChoiceGroup-SelectedChoices] group. Ratings between 0° and 50° mean that you do not feel favorable toward that [QID262-ChoiceGroup-SelectedChoices] group. You would rate the [QID262-ChoiceGroup-SelectedChoices] group at the 50° mark if you do not feel particularly warm or cold. - Other [QID262-ChoiceGroup-SelectedChoices] Identities/Groups,I feel uncertain that I will be accepted by others as typical/representative of being [QID261-ChoiceTextEntryValue-1] .,I feel uncertain about the characteristics that define being [QID261-ChoiceTextEntryValue-1] .,"How often do you feel that you should engage in behaviors consistent with being [QID261-ChoiceTextEntryValue-1] ?



